,File Name,Original Transcription,Model Transcription
0,19-198-0000,northanger abbey,northanger abbey
1,19-198-0001,this little work was finished in the year eighteen o three and intended for immediate publication it was disposed of to a bookseller it was even advertised,this work was finished in the year 1830and intended for immediate publicationit was dispersed databook sala it was even advertised
2,19-198-0002,neither the author nor the public have any other concern than as some observation is necessary upon those parts of the work which thirteen years have made comparatively obsolete,neither the awesome vinod public have any other concern that i have some observations is necessary on the rest of the work which the 3 years have made comparatively obsolete
3,19-198-0003,the public are entreated to bear in mind that thirteen years have passed since it was finished many more since it was begun and that during that period places manners books and opinions have undergone considerable changes,tatha black are interested to bear in mind that 13 years have passed since it was finishedmany more since it was beginand during that period places manners booksand opinionsundergone considerable changes
4,19-198-0004,chapter one no one who had ever seen catherine morland in her infancy would have supposed her born to be an heroine her situation in life,chapter 1no one had ever seen cancer in mobile and in infancy would have superstar born to be ahir 1fasciculation in life
5,19-198-0005,the character of her father and mother her own person and disposition were all equally against her her father was a clergyman without being neglected or poor and a very respectable man,character of father and motherdistillation for equality againstand where is respectable mahan
6,19-198-0006,her mother was a woman of useful plain sense with a good temper and what is more remarkable with a good constitution she had three sons before catherine was born,news for plane stands with a good temper and what is more remarkablewas a good constitutionshe had three sons before catherine was born
7,19-198-0007,where there are heads and arms and legs enough for the number but the morlands had little other right to the word for they were in general very plain and catherine for many years of her life as plain as any,whether an arms and legs enough for the numberthe moral and handle other right to the word for they were in general aeroplanens7for many years of her life as plain as any
8,19-198-0008,she had a thin awkward figure,shayaris in awkward figure
9,19-198-0009,dark lank hair and strong features so much for her person and not less unpropitious for heroism seemed her mind she was fond of all boy's plays and greatly preferred cricket,dark light hair and strong featuresso much for a personand less on professions for heroism simham mindfind about boys placeand greatly preferred cricket
10,19-198-0010,not merely to dolls but to the more heroic enjoyments of infancy nursing a dormouse feeding a canary bird or watering a rose bush indeed she had no taste for a garden,dollheroic enjoyment of infancynursingfeeding a canary bird for watering a rose bushindia had no taste for a garden
11,19-198-0011,and if she gathered flowers at all it was chiefly for the pleasure of mischief at least so it was conjectured from her always preferring those which she was forbidden to take such were her propensities,and if she gathered flowers at all it was chiefly for the pleasure of mischiefit was conjectured from always preparing those which she was forbidden to takesearch for help and cities
12,19-198-0012,her abilities were quite as extraordinary she never could learn or understand anything before she was taught and sometimes not even then for she was often inattentive and occasionally stupid,kerberos work white as externalhe never colon aur understand anything before she was tiredand some time nariyal thenfirst use of an inattentive and occasionally stupid
13,19-198-0013,her mother was three months in teaching her only to repeat the beggar's petition and after all her next sister sally could say it better than she did not that catherine was always stupid by no means,3 months in teaching her only to repeattata stationnatural next sister family could say that then cheatedstupidper no means
14,19-198-0014,she learnt the fable of the hare and many friends as quickly as any girl in england her mother wished her to learn music and catherine was sure she should like it for she was very fond of tinkling the keys of the old forlorn spinnet,shiva to the fable of the hare and many friends as quickly as any girl in englandmusiccatherine was sure she shall like itkhushi was right found thinking with keys of the alpha launch spirit
15,19-198-0015,so at eight years old she began she learnt a year and could not bear it and missus morland who did not insist on her daughters being accomplished in spite of incapacity or distaste allowed her to leave off,cellsri lanka year and canadaand message mall and you did not insist on her daughter was being accomplished in spite of incapacity of this testallowed her to liver
16,19-198-0016,french by her mother her proficiency in either was not remarkable and she shirked her lessons in both whenever she could what a strange unaccountable character for with all these symptoms of profligacy at ten years old,french by her motherproficiency and other was not remarkable and she shuttle lessons in both vanish liquidrestrained on a countable characterearly symptoms of profligacy at 10 years old
17,19-198-0017,hated confinement and cleanliness and loved nothing so well in the world as rolling down the green slope at the back of the house such was catherine morland at ten at fifteen appearances were mending,hated confinement and fine minsand love nothing so well in the world rolling down the grains look at the back of the housesuch was catherine morning at 10:00sas team appearances for mending
18,19-198-0018,she began to curl her hair and long for balls her complexion improved her features were softened by plumpness and colour her eyes gained more animation and her figure more consequence,she began to grow hair long for ballcompaction improvefeatures were softened by promptness and colouri change my animation and have to give more cancer quotes
19,19-198-0019,her love of dirt gave way to an inclination for finery and she grew clean as she grew smart she had now the pleasure of sometimes hearing her father and mother remark on her personal improvement,ke vetan information for finerymcq queen ashi growsmarti had the pleasure of sometimes hearing her father and mother ramakant her personal improvement
20,19-198-0020,catherine grows quite a good looking girl she is almost pretty today were words which caught her ears now and then and how welcome were the sounds to look almost pretty,seven crows quite a good looking girlthere is almost pretty todaywords which country is now and then and have welcome that soundsalmost 40
21,19-198-0021,than a beauty from her cradle can ever receive missus morland was a very good woman and wished to see her children everything they ought to be but her time was so much occupied in lying in and teaching the little ones,when a beauty from her cradle can ever receivemrs moment was a very good morningand wished to see her children everything they ought to bebut that time was so much occupied in line in teaching the other one
22,19-198-0022,that her elder daughters were inevitably left to shift for themselves and it was not very wonderful that catherine who had by nature nothing heroic about her should prefer cricket baseball riding on horseback,inevitably left to shift for themselvesand it was not a wonderful 7you had by nature nothing heroic about hercertificatebaseballriding on horseback
23,19-198-0023,and running about the country at the age of fourteen to books or at least books of information for provided that nothing like useful knowledge could be gained from them provided they were all story and no reflection,running a country at age of 14 to booksforest book seller informationfor provided that nothing like useful knowledge could be gained from themmoral story and reflection
24,19-198-0024,she had never any objection to books at all but from fifteen to seventeen she was in training for a heroine she read all such works as heroines must read to supply their memories with those quotations which are so serviceable,any objection to boxerfrom 16 to 17 she was in training for a heroinesharad of such works as heroines mastery to supply their memories with quotations which are so serviceable
25,19-198-0025,many a flower is born to blush unseen and waste its fragrance on the desert air from thompson that it is a delightful task to teach the young idea how to shoot,many a flower is born to blush unseen and waste its fragrance on the desert airsam thompsonit is a delight for testchitti how to shoot
26,19-198-0026,and from shakespeare she gained a great store of information amongst the rest that trifles light as air are to the jealous confirmation strong as proofs of holy writ,and from shakespeare's again the great storage informationamong the rest thattrifles light as air to the jealous confirmations strong as proofs of holy writ
27,19-198-0027,that the poor beetle which we tread upon in corporal sufferance feels a pang as great as when a giant dies and that a young woman in love always looks,thatthe four beta which we tried open in copper reference field shipping as great as 18 joined iseand very young woman in love always looks
28,19-198-0028,like patience on a monument smiling at grief so far her improvement was sufficient and in many other points she came on exceedingly well for though she could not write sonnets,like patience on a monument smiling at griefsofa improvement was sufficientand in many other points she came on exceedingly wellwhether she could not write sonnets
29,19-198-0029,she brought herself to read them and though there seemed no chance of her throwing a whole party into raptures by a prelude on the pianoforte of her own composition she could listen to other people's performance with very little fatigue,shiva ss tv damand then there's no chance of having a whole party into raptures by a prelude on the can of wateressay on compositionshikhar listen to other people's performance with where is the effect
30,19-198-0030,her greatest deficiency was in the pencil she had no notion of drawing not enough even to attempt a sketch of her lover's profile that she might be detected in the design,greatest efficiency was in the pencilshe had no notion of drawingnot enough even to attempt a sketch of a lover's profile that you might be detected in the design
31,19-198-0031,there she fell miserably short of the true heroic height at present she did not know her own poverty for she had no lover to portray she had reached the age of seventeen,where she found miserably shot of the true heightat present she did not know her around our team for she had no power to portraysee her weight the age of 17
32,19-198-0032,without having seen one amiable youth who could call forth her sensibility without having inspired one real passion and without having excited even any admiration but what was very moderate and very transient,what are having seen one amiable used to call forehead sensitivitywithout having inspired one rio passionhaving excited even any admiration but what was very moderate and very transient
33,19-198-0033,this was strange indeed but strange things may be generally accounted for if their cause be fairly searched out there was not one lord in the neighbourhood no not even a baronet,strange indeedstrange things may be generally accounted for if the cost be fairly self starti was not one lot in the neighbourhood no not even a baronet
34,19-198-0034,there was not one family among their acquaintance who had reared and supported a boy accidentally found at their door not one young man whose origin was unknown her father had no ward and the squire of the parish no children,i was not one family among acquaintance who had read and supported a boy accidentally found their doorone young man whose origin was unknownmy father had no wordand the square of the parish not children
35,19-198-0035,but when a young lady is to be a heroine the perverseness of forty surrounding families cannot prevent her something must and will happen to throw a hero in her way mister allen,what is tv heroineeffectiveness of forty surrounding families cannot preventsomething must and will happen to throw a hero in hawaiimr oven
36,19-198-0036,who owned the chief of the property about fullerton the village in wiltshire where the morlands lived was ordered to bath for the benefit of a gouty constitution and his lady a good humoured woman fond of miss morland and probably aware that if,who owned the chief of the property about forgottentomorrowland livewhat's the order to that for the benefit of egality constitutionaddress lady a good humour womensmall and and probably aware that
37,19-198-0037,she must seek them abroad invited her to go with them,chicken abroadinvited her to go with them
